{
  "$schema": "https://cs.ddradar.app/software-schema.json",
  "id": "best",
  "name": "Dance Dance Revolution BEST HITS",
  "platform": "Play Station",
  "region": "JP",
  "launched": "2000-12-21",
  "songs": [
    {
      "id": "after-the-game-of-love",
      "name": "AFTER THE GAME OF LOVE",
      "artist": "NPD3",
      "bpm": 105,
      "charts": [
        {
          "playStyle": "SINGLE",
          "difficulty": 5,
          "level": 1
        },
        {
          "playStyle": "SINGLE",
          "difficulty": 1,
          "level": 1
        },
        {
          "playStyle": "SINGLE",
          "difficulty": 2,
          "level": 4
        },
        {
          "playStyle": "SINGLE",
          "difficulty": 3,
          "level": 5
        },
        {
          "playStyle": "DOUBLE",
          "difficulty": 1,
          "level": 2
        },
        {
          "playStyle": "DOUBLE",
          "difficulty": 2,
          "level": 4
        },
        {
          "playStyle": "DOUBLE",
          "difficulty": 3,
          "level": 6
        },
        {
          "playStyle": "UNISON",
          "difficulty": 1,
          "level": 1
        },
        {
          "playStyle": "UNISON",
          "difficulty": 2,
          "level": 4
        },
        {
          "playStyle": "UNISON",
          "difficulty": 3,
          "level": 5
        }
      ]
    },
    {
      "id": "boom-boom-dollar",
      "name": "BOOM BOOM DOLLAR",
      "artist": "King Kong & D. Jungle Girls",
      "bpm": 135,
      "charts": [
        {
          "playStyle": "SINGLE",
          "difficulty": 0,
          "level": 1
        },
        {
          "playStyle": "SINGLE",
          "difficulty": 1,
          "level": 2
        },
        {
          "playStyle": "SINGLE",
          "difficulty": 2,
          "level": 5
        },
        {
          "playStyle": "SINGLE",
          "difficulty": 3,
          "level": 6
        },
        {
          "playStyle": "DOUBLE",
          "difficulty": 1,
          "level": 3
        },
        {
          "playStyle": "DOUBLE",
          "difficulty": 2,
          "level": 5
        },
        {
          "playStyle": "DOUBLE",
          "difficulty": 3,
          "level": 7
        },
        {
          "playStyle": "UNISON",
          "difficulty": 1,
          "level": 2
        },
        {
          "playStyle": "UNISON",
          "difficulty": 2,
          "level": 5
        },
        {
          "playStyle": "UNISON",
          "difficulty": 3,
          "level": 6
        }
      ]
    },
    {
      "id": "brilliant-2u",
      "name": "BRILLIANT 2U",
      "artist": "NAOKI",
      "bpm": 150,
      "charts": [
        {
          "playStyle": "SINGLE",
          "difficulty": 0,
          "level": 1
        },
        {
          "playStyle": "SINGLE",
          "difficulty": 1,
          "level": 4
        },
        {
          "playStyle": "SINGLE",
          "difficulty": 2,
          "level": 5
        },
        {
          "playStyle": "SINGLE",
          "difficulty": 3,
          "level": 6
        },
        {
          "playStyle": "DOUBLE",
          "difficulty": 1,
          "level": 4
        },
        {
          "playStyle": "DOUBLE",
          "difficulty": 2,
          "level": 5
        },
        {
          "playStyle": "DOUBLE",
          "difficulty": 3,
          "level": 7
        },
        {
          "playStyle": "UNISON",
          "difficulty": 1,
          "level": 4
        },
        {
          "playStyle": "UNISON",
          "difficulty": 2,
          "level": 5
        },
        {
          "playStyle": "UNISON",
          "difficulty": 3,
          "level": 6
        }
      ]
    },
    {
      "id": "butterfly-smiledk",
      "name": "butterfly",
      "artist": "smile. dk",
      "bpm": 135,
      "charts": [
        {
          "playStyle": "SINGLE",
          "difficulty": 0,
          "level": 1
        },
        {
          "playStyle": "SINGLE",
          "difficulty": 1,
          "level": 3
        },
        {
          "playStyle": "SINGLE",
          "difficulty": 2,
          "level": 4
        },
        {
          "playStyle": "SINGLE",
          "difficulty": 3,
          "level": 5
        },
        {
          "playStyle": "DOUBLE",
          "difficulty": 1,
          "level": 4
        },
        {
          "playStyle": "DOUBLE",
          "difficulty": 2,
          "level": 5
        },
        {
          "playStyle": "DOUBLE",
          "difficulty": 3,
          "level": 6
        },
        {
          "playStyle": "UNISON",
          "difficulty": 1,
          "level": 3
        },
        {
          "playStyle": "UNISON",
          "difficulty": 2,
          "level": 4
        },
        {
          "playStyle": "UNISON",
          "difficulty": 3,
          "level": 5
        }
      ]
    },
    {
      "id": "captain-jack",
      "name": "CAPTAIN JACK (GRANDALE REMIX)",
      "artist": "CAPTAIN JACK",
      "bpm": 170,
      "charts": [
        {
          "playStyle": "SINGLE",
          "difficulty": 0,
          "level": 1
        },
        {
          "playStyle": "SINGLE",
          "difficulty": 1,
          "level": 4
        },
        {
          "playStyle": "SINGLE",
          "difficulty": 2,
          "level": 7
        },
        {
          "playStyle": "SINGLE",
          "difficulty": 3,
          "level": 9
        },
        {
          "playStyle": "DOUBLE",
          "difficulty": 1,
          "level": 5
        },
        {
          "playStyle": "DOUBLE",
          "difficulty": 2,
          "level": 7
        },
        {
          "playStyle": "DOUBLE",
          "difficulty": 3,
          "level": 9
        },
        {
          "playStyle": "UNISON",
          "difficulty": 1,
          "level": 4
        },
        {
          "playStyle": "UNISON",
          "difficulty": 2,
          "level": 7
        },
        {
          "playStyle": "UNISON",
          "difficulty": 3,
          "level": 9
        }
      ]
    },
    {
      "id": "dam-dariram",
      "name": "DAM DARIRAM",
      "artist": "JOGA",
      "bpm": 142,
      "charts": [
        {
          "playStyle": "SINGLE",
          "difficulty": 0,
          "level": 1
        },
        {
          "playStyle": "SINGLE",
          "difficulty": 1,
          "level": 4
        },
        {
          "playStyle": "SINGLE",
          "difficulty": 2,
          "level": 6
        },
        {
          "playStyle": "SINGLE",
          "difficulty": 3,
          "level": 8
        },
        {
          "playStyle": "DOUBLE",
          "difficulty": 1,
          "level": 4
        },
        {
          "playStyle": "DOUBLE",
          "difficulty": 2,
          "level": 5
        },
        {
          "playStyle": "DOUBLE",
          "difficulty": 3,
          "level": 8
        },
        {
          "playStyle": "UNISON",
          "difficulty": 1,
          "level": 4
        },
        {
          "playStyle": "UNISON",
          "difficulty": 2,
          "level": 6
        },
        {
          "playStyle": "UNISON",
          "difficulty": 3,
          "level": 8
        }
      ]
    },
    {
      "id": "drop-the-bomb",
      "name": "DROP THE BOMB",
      "artist": "Scotty D.",
      "bpm": 150,
      "charts": [
        {
          "playStyle": "SINGLE",
          "difficulty": 5,
          "level": 1
        },
        {
          "playStyle": "SINGLE",
          "difficulty": 1,
          "level": 4
        },
        {
          "playStyle": "SINGLE",
          "difficulty": 2,
          "level": 5
        },
        {
          "playStyle": "SINGLE",
          "difficulty": 3,
          "level": 6
        },
        {
          "playStyle": "DOUBLE",
          "difficulty": 1,
          "level": 4
        },
        {
          "playStyle": "DOUBLE",
          "difficulty": 2,
          "level": 5
        },
        {
          "playStyle": "DOUBLE",
          "difficulty": 3,
          "level": 6
        },
        {
          "playStyle": "UNISON",
          "difficulty": 1,
          "level": 4
        },
        {
          "playStyle": "UNISON",
          "difficulty": 2,
          "level": 5
        },
        {
          "playStyle": "UNISON",
          "difficulty": 3,
          "level": 6
        }
      ]
    },
    {
      "id": "dub-i-dub",
      "name": "DUB I DUB",
      "artist": "ME & MY",
      "bpm": 136,
      "charts": [
        {
          "playStyle": "SINGLE",
          "difficulty": 0,
          "level": 1
        },
        {
          "playStyle": "SINGLE",
          "difficulty": 1,
          "level": 4
        },
        {
          "playStyle": "SINGLE",
          "difficulty": 2,
          "level": 6
        },
        {
          "playStyle": "SINGLE",
          "difficulty": 3,
          "level": 8
        },
        {
          "playStyle": "DOUBLE",
          "difficulty": 1,
          "level": 5
        },
        {
          "playStyle": "DOUBLE",
          "difficulty": 2,
          "level": 7
        },
        {
          "playStyle": "DOUBLE",
          "difficulty": 3,
          "level": 7
        },
        {
          "playStyle": "UNISON",
          "difficulty": 1,
          "level": 4
        },
        {
          "playStyle": "UNISON",
          "difficulty": 2,
          "level": 6
        },
        {
          "playStyle": "UNISON",
          "difficulty": 3,
          "level": 8
        }
      ]
    },
    {
      "id": "dynamite-rave",
      "name": "DYNAMITE RAVE",
      "artist": "NAOKI",
      "bpm": 150,
      "charts": [
        {
          "playStyle": "SINGLE",
          "difficulty": 0,
          "level": 1
        },
        {
          "playStyle": "SINGLE",
          "difficulty": 1,
          "level": 5
        },
        {
          "playStyle": "SINGLE",
          "difficulty": 2,
          "level": 7
        },